DATE,TITLE,MAIN_NEWS,SOURCE_URL
"&#2408;&#2407; बैशाख &#2408;&#2406;&#2413;&#2413;, आइतबार &nbsp;",लकडाउनका बेला सिमेन्ट कालोबजारी गरेको भन्दै २ जना पक्राउ,"<strong>जनकपुरधाम</strong>– कोरोना भाइरस (कोभिड १९) महामारी नियन्त्रणका लागि जारी लकडाउनका बेला सिमेन्टको कालोबजारी गरेको अभियोगमा धनुषा प्रहरीले २ जनालाई पक्राउ गरेको छ । पक्राउ पर्नेमा जनकपुर उपमहानगरपालिका–११ स्थित आनन्द इन्टर प्राइजेजका सञ्चालक ४८ वर्षीय राम प्रताप साह र जनकपुर–४ माछाबजारस्थित चन्दन आइरन स्टोरका सञ्चालन सत्यनारायण चौधरीका २० वर्षीया छोरा चन्चल कुमार चौधरी छन् । प्रहरीका अनुसार दुवै जनालाई बजार भाउभन्दा बढी मूल्य लिएर सिमेन्ट बिक्री गर्दै आएका थिए । <img decoding=""async"" class=""size-full wp-image-159829 alignnone jetpack-lazy-image"" src=""https://i0.wp.com/sgp1.digitaloceanspaces.com/appharus1/khubs3/uploads/2020/05/cement.jpg?resize=720%2C521&#038;ssl=1"" alt width=""720"" height=""521"" data-recalc-dims=""1"" data-lazy-srcset=""https://i0.wp.com/www.khabarhub.com/wp-content/uploads/2020/05/cement.jpg?w=2048&amp;ssl=1 2048w, https://i0.wp.com/www.khabarhub.com/wp-content/uploads/2020/05/cement.jpg?resize=768%2C556&amp;ssl=1 768w, https://i0.wp.com/www.khabarhub.com/wp-content/uploads/2020/05/cement.jpg?resize=1536%2C1112&amp;ssl=1 1536w, https://i0.wp.com/www.khabarhub.com/wp-content/uploads/2020/05/cement.jpg?w=1440&amp;ssl=1 1440w"" data-lazy-sizes=""(max-width: 720px) 100vw, 720px"" data-lazy-src=""https://i0.wp.com/sgp1.digitaloceanspaces.com/appharus1/khubs3/uploads/2020/05/cement.jpg?resize=720%2C521&amp;is-pending-load=1#038;ssl=1"" srcset=""data:image/gif;base64,R0lGODlhAQABAIAAAAAAAP///yH5BAEAAAAALAAAAAABAAEAAAIBRAA7""><noscript><img data-lazy-fallback=""1"" decoding=""async"" class=""size-full wp-image-159829 alignnone"" src=""https://i0.wp.com/sgp1.digitaloceanspaces.com/appharus1/khubs3/uploads/2020/05/cement.jpg?resize=720%2C521&#038;ssl=1"" alt="""" width=""720"" height=""521"" srcset=""https://i0.wp.com/www.khabarhub.com/wp-content/uploads/2020/05/cement.jpg?w=2048&amp;ssl=1 2048w, https://i0.wp.com/www.khabarhub.com/wp-content/uploads/2020/05/cement.jpg?resize=768%2C556&amp;ssl=1 768w, https://i0.wp.com/www.khabarhub.com/wp-content/uploads/2020/05/cement.jpg?resize=1536%2C1112&amp;ssl=1 1536w, https://i0.wp.com/www.khabarhub.com/wp-content/uploads/2020/05/cement.jpg?w=1440&amp;ssl=1 1440w"" sizes=""(max-width: 720px) 100vw, 720px"" data-recalc-dims=""1""  /></noscript> स्थानीय उपभोक्ताको सूचनाको आधारमा पुगेको प्रहरीले आनन्द इन्टर प्राइजेजको गोदामबाट ४९ बोरा सिमेन्ट समेत बरामद गरेको छ । यस्तै, जनकपुर–४ माछाबजारस्थित चन्दन आइरन स्टोरबाट ४ सय २० बोरा सिमेन्ट बरामद भएको जिल्ला प्रहरी कार्यालय धनुषाले जानकारी दिएको छ । प्रहरीले दुवै सिमेन्ट पसलमा सिलबन्दी गरेर आवश्यक अनुसन्धान अगाडि बढाइएको जनाएको छ ।",https://www.khabarhub.com/2020/03/159827/
"&#2407;&#2412; बैशाख &#2408;&#2406;&#2413;&#2413;, मंगलबार &nbsp;",सरकारका गतिविधिको विरोध गर्दै तरुणदलद्वारा तनहुँमा प्रदर्शन,<strong>तनहुँ-</strong> नेपाली कांग्रेसको भ्रातृ संगठन तरुण दलले तनहुँको दमौलीमा विरोध प्रदर्शन गरेको छ । सरकारका पछिल्ला गतिविधिको विरोध गर्दै तरुणदलले प्रदर्शन गरेको हो । तरुण दल व्यास नगर समितिले गरेको विरोध प्रदर्शनका क्रममा प्रहरीले हस्तक्षेप गरेको तरुण दलले जनाएको छ । प्रहरी र तरुण दलका कार्यकर्ताबीच केहीबेर झडपसमेत भएको थियो । तरुण दलका नेता–कार्यकर्ताले नाराबाजी गर्दै बजार परिक्रमा गरी कोणसभामा सामेल भएका थिए । &nbsp; &nbsp;,https://www.khabarhub.com/2020/28/157773/
"&#2408;&#2414; चैत्र &#2408;&#2406;&#2413;&#2412;, शुक्रबार &nbsp;",ग्यासमा कालोबजारी गर्ने पक्राऊ,पर्वत &#8211; लकडाउनको फाइदा उठाउँदै खाना पकाउने एलपी ग्यास बढी मूल्यमा बेचेको आरोपमा जिल्ला प्रहरी कार्यालय पर्वतले एक व्यवसायीलाई पक्राउ गरेको छ । उपभोक्ताहरुको गुनासोका आधारमा प्रहरीले जलजला गाउँपालिका–३ वारिवेनीमा व्यवसाय गरी बस्ने मीनप्रसाद रेग्मीलाई बिहीबार नियन्त्रणमा लिएको हो । वारिवेनीमा सञ्चालित दिप्सन मेटल स्टोर्सका सञ्चालक रेग्मीमाथि बजार मूल्यभन्दा बढी रकम लिएर ग्यास बिक्री गरेको उपभोक्ताको आरोप छ । नेपाल आयल निगमले प्रतिसिलिण्डर ग्यासको मूल्य एक हजार ३७५ तथा ढुवानीसहित भरी सिलिण्डरको एक हजार ४०० र आधा सिलिण्डरको ७०० रुपैयाँ तोकेको छ । रेग्मीले एक हजार ७०० रुपैयाँ लिएर ग्यास बिक्री गरेको पाइएकाले पक्राउ गरेको प्रहरीले जनाएको छ । पीडित उपभोक्ताले जिल्ला प्रहरी कार्यालय पर्वत र जिल्ला प्रशासन कार्यालय पर्वतमा खरिद बिल र लिखित उजुरीसहित गुनासो गरेपछि प्रहरीले व्यवसायी रेग्मीलाई निजकै पसलबाट पक्राउ गरेको हो ।,https://www.khabarhub.com/2020/10/150479/
"&#2408;&#2408; चैत्र &#2408;&#2406;&#2413;&#2412;, शनिबार &nbsp;",बढी मूल्यमा पेट्रोल बेच्ने पक्राउ,सिन्धुपाल्चोक &#8211; बजार मूल्यभन्दा बढी रकम लिई पेट्रोल बिक्री गरिरहेको अवस्थामा सिन्धुपाल्चोकबाट एक जनालाई प्रहरीले पक्राउ गरेको छ । पक्राउ पर्नेमा चौतारा साँगाचोकगढी नगरपालिका–७ मेलचौरस्थित जयमाता वनदेवी फ्युल सेन्टरका कर्मचारी कपिलवस्तु विजयनगर गाउँपालिका–५ का महेशकुमार चौधरी रहेका छन् । कोरोना भाइरसको जोखिम न्यूनीकरणका लागि नेपाल सरकारले लागू गरेको लकडाउनको समयमा बजार मूल्यभन्दा बढी प्रतिलिटर ११० का दरले पेट्रोल बेचिरहेको अवस्थामा चौधरीलाई पक्राउ गरिएको जिल्ला प्रहरी कार्यालय सिन्धुपाल्चोकका प्रहरी नायब उपरीक्षक माधवप्रसाद काफ्लेले जानकारी दिए । पेट्रोलपम्पमा कार्यरत कर्मचारीले बिल नदिई बजार मूल्यभन्दा बढी रकम लिएर पेट्रोल बेच्दै आइरहेको अवस्थामा उनलाई पक्राउ गरिएको प्रहरी नायब उपरीक्षक काफ्लेले बताए ।,https://www.khabarhub.com/2020/04/148498/
"&#2407;&#2407; बैशाख &#2408;&#2406;&#2413;&#2413;, बिहीबार  &nbsp;",लकडाउनमा बढी मूल्य लिने ४ पसललाई कारबाही,"काठमाडौं- लकडाउनको समयमा बढी मूल्यमा खाद्यान्न, मासु तथा फलफूल बिक्री वितरण गर्ने चार पसललाई कारवाहीस्वरुप आज जरिवाना गरिएको छ । वाणिज्य, आपूर्ति तथा उपभोक्ता संरक्षण विभागको टोलीले बजार अनुगमनका क्रममा लपु, महालक्ष्मी नगरपालिका वडा नम्बर १ इमाडोलस्थित कटुवाल स्टोर्सलाई रु दुई लाख जरिवाना गरिएको जनाएको छ । आयोडिन नुन बढी मूल्यमा बिक्री गरेको पाइएकाले सो पसललाई जरिवाना गरिएको विभागका अनुगमन निरीक्षक दीपक पोखरेलले जानकारी दिए । उनका अनुसार काठमाडौँ, ज्ञानेश्वरस्थित राजेन्द्र मिट सपमा मूल्यसूची नभएकाले रु पचास हजार जरिवाना गरिएको छ । त्यस्तै इमाडोलस्थित मुकेश जुस तथा फलफूल पसल र बाबुलाल फलफूल तथा तरकारी पसललाई मूल्यसूची नभएवापत रु ५०/५० हजार जरिवाना गरिएको छ । इमाडोलको बाबुलाल फलफूल तथा तरकारी पसलबाट रु पाँच हजार आठ सय मूल्य बराबरको खान अयोग्य तथा म्याद सकिएका सामान तत्काल नष्ट गर्न वा सम्बन्धित निकायमा फिर्ता गर्न लगाइएको उनले जानकारी दिए । उपभोक्ता संरक्षण ऐन, २०७५ बमोजिम सो जरिवाना गरिएको विभागले जनाएको छ ।",https://www.khabarhub.com/2020/23/155743/
"&#2407;&#2407; बैशाख &#2408;&#2406;&#2413;&#2413;, बिहीबार &nbsp;",सीमा सुरक्षाका लागि खटिएका सशस्त्र प्रहरीमाथि भारतीय नागरिकद्वारा आक्रमण,<strong>धनगढी</strong>– कैलालीको धनगढी उपमहानगरपालिकाअन्तर्गत नेपाल–भारत सीमा क्षेत्रमा खटिएका सुरक्षाकर्मीमाथि भारतीय नागरिकले आक्रमण गरेका छन् । नेपाली–भारत सीमा क्षेत्र कैलालीको धनगढी उपमहानगरपालिका–२ मन्दिरघाटमा खटिएका सशस्त्र प्रहरीमाथि भारतीयहरुले आक्रमण गरेका हुन् । सरकारले कोरोना भाइरसको संक्रमण फैलिन नदिन जारी गरेको लकडाउनको अवधिमा पनि भारतीयहरु नेपाल भित्रिन थालेपछि सीमा क्षेत्रमा सशस्त्र प्रहरीको गस्ती बढाइएको थियो । जसअन्तर्गत कैलालीका सीमावर्ती क्षेत्रमा पनि सशस्त्र प्रहरीको परिचालन बढाइएको थियो । सरकारले सीमा क्षेत्र खटाएअनुसार परिचालन भएका सशस्त्र प्रहरीका सुरक्षाकर्मीमाथि मंगलबार भारतीय नागरिकहरुले आक्रमण गरेका हुन् । सीमावर्ती भारतीय गाउँ वनगाउँका थारु समुदायका व्यक्तिहरुले सशस्त्र प्रहरीमाथि आक्रमण गरेका जिल्ला प्रहरी कार्यालय कैलालीले जानकारी दिएको छ । जिल्ला प्रशासन कार्यालय कैलालीका अनुसार भारतीयको आक्रमणबाट सशस्त्र प्रहरीका एकजना कर्मचारीको आँखामा चोट लागेको थियो । उनको कैलालीको गेटास्थित आँखा अस्पतालमा उपचार भएको जनाइएको छ ।,https://www.khabarhub.com/2020/23/155640/
"&#2407;&#2406; बैशाख &#2408;&#2406;&#2413;&#2413;, बुधबार &nbsp;",बालिकामाथि बलात्कार गरेको आरोपमा २ जना पक्राउ,<strong>वाणगङ्गा</strong>– कपिलवस्तुको वाणगङ्गा नगरपालिका वडा नं ४ मा बालिकामाथि बलात्कार गरेको आरोपमा प्रहरीले आज २ जनालाई पक्राउ गरेको छ । पक्राउ पर्नेमा ४५ वर्षीय र १७ वर्षीय युवक छन् । ती दुवै छिमेकी हुन् । अभियुक्तको नाम प्रहरीले गोप्य राखेको छ । प्रलोभनमा पारेर पाँच वर्षदेखि बालिकामाथि बलात्कार भएको पीडित परिवारले जनाएको छ । स्थानीयवासीले बन्दाबन्दी भए पनि घर बाहिर आई न्यायका लागि आवाज उठाएका छन् । पीडितहरुले अपराध गर्नुभन्दा पनि सहनु गलत भएको जनाउँदै उनीहरुलाई कारवाहीको माग गरेका छन् ।,https://www.khabarhub.com/2020/22/155060/
"&#2408;&#2413; चैत्र &#2408;&#2406;&#2413;&#2412;, बिहीबार &nbsp;","राहत बाँड्न पुगेका जनप्रतिनिधिमाथि हातपात, दुई जना पक्राउ",झापा- कोरोना भाइरसको संक्रमण फैलन नदिन लकडाउन गरिएपछि समस्यामा परेका विपन्न वर्गका परिवारलाई राहत वितरणका लागि पुगेका जनप्रतिनिधिमाथि हातपात भएको छ । झापाको गौरीगञ्ज गाउँपालिका- २ मा विपन्न वर्गका परिवारलाई राहत बाँड्न पुगेका जनप्रतिनिधिमाथि हातपात भएको हो । वडा नम्बर २ स्थित हेम्नाडांगी सतार बस्तीमा राहत बाँड्न पुगेका वडा सदस्य अरुणकुमार राजवंशीमाथि बुधबार साँझ हातपात भएको प्रहरीले जनाएको छ । वडा सदस्य राजवंशीमाथि हातपात गरेको आरोपमा सोही ठाउँका सोम मुर्मु र अन्य एक जनालाई प्रहरीले पक्राउ गरेको छ । वडा कार्यालयले गरेको लगत सङ्कलनमा विपन्न परिवारको नाम छुटाएको भन्दै वडा सदस्य राजवंशीमाथि उनीहरूले हातपात गरेका थिए । वडा कार्यालयले बुधबार बिपन्न परिवारलाई राहत वितरण गरेको छ भने यसअघि चार सय पाँच परिवारलाई राहत वितरण गरिएको थियो ।,https://www.khabarhub.com/2020/09/150193/
"&#2408;&#2412; चैत्र &#2408;&#2406;&#2413;&#2412;, बुधबार &nbsp;",मेयरले मास्क वितरणमा पनि राजनीति गरेको भन्दै विरोध,"<strong>जोगबुढा</strong>– डडेल्धुराको परशुराम नगरपालिकामा मास्क वितरणका लागि नगरप्रमुखले पार्टी कार्यकर्तालाई जिम्मा दिएको भन्दै वडाध्यक्षहरुले विरोध जनाएका छन् । आफ्नै वडामा मास्क वितरण भईरहदा आफुहरु अनविज्ञ रहेको वडाध्यक्षहरुको भनाइ छ । संघीय सरकारले नै हरेक क्षेत्रबाट प्राप्त राहत सामाग्री जनप्रतिनिधिमार्फत वितरण गर्ने निर्णय गरी सर्कुल जारी गरे पनि नगरप्रमुख भीमबहादुर साउँदले आफू निकटका व्यक्ति तथा पार्टीका कार्यकर्ताहरुलाई परिचालन गरेको वडाध्यक्षहरुको आरोप छ । परशुराम नगरपालिका वडा नम्बर ९ का अध्यक्ष रमेश बोहरा कोरोनाको संक्रमण फैलिन नदिन र जनतालाई सचेत बनाउन एकद्वार प्रणालीमार्फत राहत तथा अन्य अत्यावश्यक सामग्री वितरण गरिनुपर्ने बताउँछन् । तर, नगर प्रमुखले नै केन्द्र सरकारको निर्णयको समेत बेवास्ता गरी वडाहरुमा मास्क वितरण गर्नका लागि आफ्नो पार्टीका कार्यकर्ता परिचालन गरेको उनको भनाइ छ । परशुराम नगरपालिका वडा नम्बर ४ मा नरेन्द्र बहादुर चन्द, वडा नम्बर ७ मा लक्ष्मण भट्ट, वडा नम्बर ८ मा मनोज कार्की र वडा नम्बर ९ मा मन्दीर सिंह बोहराले मास्क वितरण गरिरहेको स्थानीयले जानकारी दिएका छन् । संघिय सरकारले कार्यविधी निर्माण गरि व्यक्तिगत रुपमा राहत तथा अन्य सामाग्री वितरणमा रोक लगाएको छ । जिल्ला प्रशासन कार्यालय डडेल्धुराले चैत्र १८ गते सार्वजनिक रुपमा अपिल गर्दै व्यक्तिगत रुपमा राहत तथा अन्य सामग्री वितरण नगर्न र कसैले दिन चाहेमा स्थानिय सरकारसंग समन्वय गर्न निर्देशन समेत दिएको छ । राहत तथा अन्य सामग्री सरकारी संयन्त्र मार्फत मात्रै वितरण गर्नुपर्ने भनिएपनि नगरप्रमुख बाटै यसको उलंघन हुनु गतल भएको परशुराम नगरपालिका वडा नं. ८ का अध्यक्ष गोविन्द बोहराको भनाइ छ । वडा नम्बर ७ का अध्यक्ष केशव बोहरा भने नगरप्रमुखले राहात वितरणमा समेत राजनीति गरेको बताउँछन् । ‘बरु केही युवा साथीहरुले वडा कार्यालयलाई केही सामाग्री हस्तान्तरण गरेछन्, हामी त्यसको लगत राखेर यहाँको क्वारेन्टाईनमा भएका व्यक्तिहरुलाई उपलब्ध गराएका छौँ,’ वडाध्यक्ष बोहोराले भने । नगर प्रमुख साउदले भने आफ्नो व्यक्तिगत खर्चबाट वडाहरुमा मास्क वितरण गरेको बताउँछन् । ‘मास्कहरु कार्यकर्तालाई मात्र दिनुस भनेको छैन्,’ नगरप्रमुख साउँदले भने ‘पार्टीका साथीहरुले केहीदिन अगाडिदखि नै लगेर वितरण गरेका हुन् । अहिले त्यसो छैन ।’ साउँद नेपाली कांग्रेसबाट परशुराम नगरपालिकाको प्रमुखमा निर्वाचित भएका हुन् ।",https://www.khabarhub.com/2020/08/149881/
